{
  "schema_version": 1,
  "id": "20261029_domain_knowledge",
  "title": "Investigación y documentación AS-IS de dominios",
  "owner": "coordinator",
  "status": "closed",
  "revision": 2,
  "created_at": "2026-10-29T04:03:39.953Z",
  "updated_at": "2026-10-29T04:14:08.459Z",
  "closed_at": "2026-10-29T04:14:08.459Z",
  "retain_until": "2026-12-28T04:14:08.459Z",
  "hold": null,
  "active_tasks": [],
  "blockers": [],
  "blocked_from": null,
  "blocked_reason": null,
  "assessment": {
    "reason": "Metodología documental y routing compartidos; aceptación clara, revisión de cobertura sin cambios al producto",
    "risks": [
      "shared_surface"
    ]
  },
  "track": "standard"
}
