{
  "schema_version": 1,
  "id": "20261028_transformacion_framework_harness",
  "title": "Transformar el framework en harness de proyectos",
  "owner": "coordinador",
  "status": "closed",
  "revision": 5,
  "created_at": "2026-10-28T00:00:00.000Z",
  "updated_at": "2026-10-28T05:01:16.049Z",
  "closed_at": "2026-10-28T05:01:16.049Z",
  "retain_until": "2026-12-27T05:01:16.049Z",
  "hold": null,
  "active_tasks": [],
  "blockers": [],
  "blocked_from": null,
  "blocked_reason": null
}
