{
  "schema_version": 1,
  "id": "20261029_harness_final_audit",
  "title": "Auditoría integral de uso, bases de datos e infraestructura",
  "owner": "coordinador",
  "status": "closed",
  "revision": 3,
  "created_at": "2026-10-29T04:22:27.639Z",
  "updated_at": "2026-10-29T04:30:27.787Z",
  "closed_at": "2026-10-29T04:30:27.787Z",
  "retain_until": "2026-12-28T04:30:27.787Z",
  "hold": null,
  "active_tasks": [],
  "blockers": [],
  "blocked_from": null,
  "blocked_reason": null,
  "assessment": {
    "reason": "Revisión transversal con posibles correcciones de contratos compartidos",
    "risks": [
      "shared_surface"
    ]
  },
  "track": "standard"
}
