{
  "schema_version": 1,
  "id": "20261029_proportional_delivery",
  "title": "Entrega proporcional en tres recorridos",
  "owner": "coordinator",
  "status": "closed",
  "revision": 6,
  "created_at": "2026-10-29T03:35:08.623Z",
  "updated_at": "2026-10-29T03:53:23.936Z",
  "closed_at": "2026-10-29T03:53:23.936Z",
  "retain_until": "2026-12-28T03:53:23.936Z",
  "hold": null,
  "active_tasks": [],
  "blockers": [],
  "blocked_from": null,
  "blocked_reason": null
}
