{
  "schema_version": 1,
  "id": "20261029_unified_setup",
  "title": "Preparación automática unificada del harness",
  "owner": "coordinador",
  "status": "closed",
  "revision": 6,
  "created_at": "2026-10-29T15:55:03.810Z",
  "updated_at": "2026-10-29T16:17:11.494Z",
  "closed_at": "2026-10-29T16:17:11.494Z",
  "retain_until": "2026-12-28T16:17:11.494Z",
  "hold": null,
  "active_tasks": [],
  "blockers": [],
  "blocked_from": null,
  "blocked_reason": null,
  "assessment": {
    "reason": "Instalación explícita de herramientas transversales y resolución de runtimes",
    "risks": [
      "security",
      "shared_surface"
    ]
  },
  "track": "reinforced"
}
