{
  "schema_version": 1,
  "id": "20261028_agent_operability",
  "title": "Operabilidad y contexto distribuido del harness",
  "owner": "coordinator",
  "status": "closed",
  "revision": 6,
  "created_at": "2026-10-28T23:40:37.685Z",
  "updated_at": "2026-10-29T00:07:43.790Z",
  "closed_at": "2026-10-29T00:07:43.790Z",
  "retain_until": "2026-12-28T00:07:43.790Z",
  "hold": null,
  "active_tasks": [],
  "blockers": [],
  "blocked_from": null,
  "blocked_reason": null
}
