{
  "schema_version": 1,
  "id": "20261028_ejecucion_agentes",
  "title": "Ejecución uniforme de agentes y perfiles personales",
  "owner": "coordinator",
  "status": "closed",
  "revision": 9,
  "created_at": "2026-10-28T23:02:51.028Z",
  "updated_at": "2026-10-28T23:20:13.865Z",
  "closed_at": "2026-10-28T23:20:13.865Z",
  "retain_until": "2026-12-27T23:20:13.865Z",
  "hold": null,
  "active_tasks": [],
  "blockers": [],
  "blocked_from": null,
  "blocked_reason": null
}
