{
  "schema_version": 1,
  "id": "20261031_monorepo_apps",
  "title": "Modelo de aplicaciones y releases de monorepo",
  "owner": "coordinador",
  "status": "active",
  "revision": 1,
  "created_at": "2026-10-31T04:33:21.437Z",
  "updated_at": "2026-10-31T04:33:21.437Z",
  "closed_at": null,
  "retain_until": null,
  "hold": null,
  "active_tasks": [],
  "blockers": [],
  "blocked_from": null,
  "blocked_reason": null,
  "assessment": {
    "reason": "Documentación compartida y routing sin migración ni ejecución de releases",
    "risks": [
      "shared_surface"
    ]
  },
  "track": "standard"
}
